{
    "bodyTypeName": "muscular",
    "url": "https://sanderfrenken.github.io/Universal-LPC-Spritesheet-Character-Generator/#?body=Body_color_fur_white&head=Rabbit_fur_white&sex=muscular&shadow=none&hat=Reptile_bandana_red&hair=none&shoulders=none&arms=none&bauldron=none&bracers=none&cape=none&legs=Pants_purple&shoes=none&weapon=Thrust_hoe",
    "spritesheets": "https://sanderfrenken.github.io/Universal-LPC-Spritesheet-Character-Generator/spritesheets/",
    "version": 1,
    "datetime": "06/05/2023 16:18:17",
    "credits": "Authors: bluecarrot16, Evert, TheraHedwig, MuffinElZangano, Durrani, Sander Frenken (castelonia), Benjamin K. Smith (BenCreating), Eliza Wyatt (ElizaWy), dalonedrau, Stephen Challener (Redshrike), Nila122, David Conway Jr. (JaidynReiman), Joe White, Matthew Krohn (makrohn), Johannes Sjölund (wulax), Pierre Vigier, Tuomo Untinen, and Inboxninja\n\n- body/bodies/muscular/universal/fur_white.png: by bluecarrot16, Evert, TheraHedwig, MuffinElZangano, Durrani, Sander Frenken (castelonia), Benjamin K. Smith (BenCreating), Eliza Wyatt (ElizaWy), dalonedrau, Stephen Challener (Redshrike). License(s): CC-BY-SA 3.0. \n    - https://opengameart.org/content/liberated-pixel-cup-lpc-base-assets-sprites-map-tiles\n    - https://opengameart.org/content/lpc-barbarian-sprite-base\n    - https://opengameart.org/content/lpc-muscular-swing-animation\n    - https://opengameart.org/content/lpc-muscular-hurt-animation\n    - https://opengameart.org/content/lpc-jump-expanded\n\n- head/heads/rabbit/universal/fur_white.png: by bluecarrot16, Stephen Challener (Redshrike). License(s): OGA-BY 3.0, CC-BY 3.0, CC-BY-SA 3.0. \n    - https://opengameart.org/content/bunny-rabbit-lpc-style-for-pixelfarm\n    - http://opengameart.org/content/lpc-folk\n\n- hat/reptile/male/bandana_red.png: by Nila122. License(s): CC-BY-SA 3.0, GPL 3.0. \n    - https://opengameart.org/content/lpc-lizard-headgear\n\n- legs/pants/male/purple.png: by bluecarrot16, David Conway Jr. (JaidynReiman), Joe White, Matthew Krohn (makrohn), Johannes Sjölund (wulax). License(s): CC-BY-SA 3.0, GPL 3.0. \n    - https://opengameart.org/content/liberated-pixel-cup-lpc-base-assets-sprites-map-tiles\n    - https://opengameart.org/content/lpc-medieval-fantasy-character-sprites\n\n- tools/thrust/background/hoe.png: by bluecarrot16, Pierre Vigier, Tuomo Untinen, Johannes Sjölund (wulax), and Inboxninja. License(s): CC-BY-SA 3.0. \n    - https://opengameart.org/content/lpc-hand-tools\n\n- tools/thrust/foreground/hoe.png: by bluecarrot16, Pierre Vigier, Tuomo Untinen, Johannes Sjölund (wulax), and Inboxninja. License(s): CC-BY-SA 3.0. \n    - https://opengameart.org/content/lpc-hand-tools",
    "layers": [
      {
        "fileName": "tools/thrust/background/hoe.png",
        "zPos": 9,
        "parentName": "weapon",
        "name": "Thrust",
        "variant": "hoe"
      },
      {
        "fileName": "body/bodies/muscular/universal/fur_white.png",
        "zPos": 10,
        "parentName": "body",
        "name": "Body color",
        "variant": "fur_white"
      },
      {
        "fileName": "legs/pants/male/purple.png",
        "zPos": 20,
        "parentName": "legs",
        "name": "Pants",
        "variant": "purple"
      },
      {
        "fileName": "head/heads/rabbit/universal/fur_white.png",
        "zPos": 100,
        "parentName": "head",
        "name": "Rabbit",
        "variant": "fur_white"
      },
      {
        "fileName": "hat/reptile/male/bandana_red.png",
        "zPos": 130,
        "parentName": "hat",
        "name": "Reptile",
        "variant": "bandana red"
      },
      {
        "fileName": "tools/thrust/foreground/hoe.png",
        "zPos": 150,
        "parentName": "weapon",
        "name": "Thrust",
        "variant": "hoe"
      }
    ]
  }